"MUNICÍPIO","NOME DA BIBLIOTECA","VÍNCULO","ENDEREÇO","BAIRRO","TELEFONE","E-MAIL"
"Abadia de Goiás","Biblioteca Pública Municipal Eisenhower Pinheiro Lana","Municipal","Avenida Comercial, Quadra 06, Lote 07","Centro","(62) 3503-1716",""
"Abadiânia","Biblioteca Pública Municipal  Frei Matheus Rocha","Municipal","Avenida Geraldo Rodrigues dos Santos, s/n","Centro","(62) 3343-2285",""
"Acreúna","Biblioteca Pública Municipal Jerônimo Martins Marques","Municipal","Rua Jordelina do Carmo Arantes, 86","Serra Dourada","(64) 3645-8009",""
"Adelândia","Biblioteca Pública Municipal Nocomedis Joaquim da Silva","Municipal","Rua João Afonso, s/n","Seror Noroeste","(64) 3695-1426",""
"Água Fria de Goiás","Biblioteca Pública Municipal  de Água Fria de Goiás","Municipal","Avenida João Orivê Rodrigues, Quadra 32, Lote 01","Centro","6234641138",""
"Água Limpa","Biblioteca Pública Municipal Lêda Aparecida do Prado Cunha","Municipal","Praça da Matriz, s/n","Centro","(64) 3489-1276",""
"Águas Lindas de Goiás","Biblioteca Pública Municipal Cora Coralina","Municipal","Quadra 31, Conjunto B, Lote 1A","Setor 2","(61) 9622-7465",""
"Alexânia","Biblioteca Publica de Alexãnia","Municiapal","Rua 76, Quadra 66, lote 01, Setor Sudoeste, Alexânia/GO","Centro","(62) 99973-2496",""
"Alexânia","Biblioteca Pública Municipal de Alexânia","Municipal","Avenida Nelson Santos, s/n","Centro","(62) 3336-1113",""
"Aloândia","Biblioteca Pública Municipal de Aloandia","Municipal","Avenida 24 de junho, 38","Centro","",""
"Alto Horizonte","Biblioteca Pública Municipal de Alto Horizonte","Municipal","Rua Ribeiro Otoni, 62","Bela Vista","(62) 3383-3235",""
"Alto Paraíso de Goiás","Biblioteca Pública Municipal  Professora Maria da Costa Pires","Municipal","Rua Lorino Barbosa, s/n","Centro","(62) 3446-1003",""
"Alvorada do Norte","Biblioteca Pública Municipal Cultura Viva","Municipal","Rua da Consolação, s/n","Centro","(62) 3421-1618",""
"Amaralina","Biblioteca Pública Municipal  Cora Coralina","Municipal","Rua Assembleia de Deus, s/n","Centro","(62) 3384-3140",""
"Americano do Brasil","Biblioteca Pública Municipal Joaquim de Paula Rosa","Municipal","Rua Três Poderes, s/n","Centro","(64) 3504-1772",""
"Amorinópolis","Biblioteca Pública Municipal Professor Dinamérico Correa Guimarães","Municipal","Rua São Paulo, 252","Centro","(64) 3677-1151",""
"Anápolis","Biblioteca Pública Municipal Zeca Batista","Municipal","Praça Americano do Brasil, S/N","Setor Central","(62) 3902-1013","bibliotecamunicipalzb@edu.anapolis.go.gov.br"
"Anhanguera","Biblioteca Pública Municipal de Anhanguera","Municipal","Avenida Belchior de Godoy, s/n","Centro","(64) 3469-1140",""
"Anicuns","Biblioteca Pública Municipal José de Sena Chard","Municipal","Avenida Tocantins, s/n","Centro","",""
"Aparecida de Goiânia","Biblioteca Pública Municipal Manoel Antônio do Carmo","Municipal","Avenida Benedito Silvestre Toledo, s/n","Independência","(62) 3537-3697",""
"Não identificado","Biblioteca Pública Municipal  Ursulino Tavares Leão","Municipal","Avenida das Nações, s/n, Quadra, 14, Lote 01","Setor Vera Cruz","(62) 3548-4809",""
"Aparecida do Rio Doce","Biblioteca Pública Municipal Firmino Barbosa Franco","Municipal","Rua Belmiro Nogueira da Silva, s/n","Centro","(64) 3637-1106",""
"Aporé","Biblioteca Pública Municipal Beija-Flor","Municipal","Avenida João Nunes, 356","Centro","(64) 3644-1181",""
"Araçu","Biblioteca Pública Municipal Professora Eunice Soyer Borges","Municipal","Rua João Elias Medeiros, s/n","Centro","",""
"Aragarças","Biblioteca Pública Municipal Jandira Ramos Cardoso","Municipal","Praça Ostácio martins de Souza, s/n","Centro","(64) 3638-3031",""
"Aragoiânia","Biblioteca Pública Municipal Manoel Alves Celes","Municipal","Avenida Goiás, 604","Centro","(62)3550-2263",""
"Araguapaz","Biblioteca Pública Municipal de Araguapaz","Municipal","Avenida Goiás, s/n","Centro","(62)3380-1198",""
"Arenópolis","Biblioteca Pública Municipal Professor Hugo Giradin","Municipal","Praça Inácio de Melo, s/n","Centro","(64)3667-1216",""
"Aurilândia","Biblioteca Pública Municipal Professor José Barbosa de Medeiros","Municipal","Rua Capitão João Gomes Porto, 360","Centro","(96)3684-1212",""
"Avelinópolis","Biblioteca Pública Municipal de Avelinópolis","Municipal","Avenida Anicuns, s/n","Centro","",""
"Barro Alto","Biblioteca Pública Municipal Dona Maria Divina da Silva","Municipal","Rua São Paulo, s/n","Centro","(62)3347-6337",""
"Bela Vista de Goiás","Biblioteca Pública Municipal de Bela Vista de Goiás","Municipal","Rua Coronel João Camilo, 338","Centro","(62)3551-7053",""
"Bom Jardim de Goiás","Biblioteca Pública Municipal Professora Alacir Alcântara","Municipal","Rua Manoel Perdigão, 20","Centro","(64)3657-1390",""
"Bom Jesus de Goiás","Biblioteca Pública Municipal Maria Cassiano dos Santos","Municipal","Praça Luís Gomes de Freitas Olímpia, s/n","Centro","(64)3608-6070",""
"Bonfinópolis","Biblioteca Pública Municipal Esaú do Carmo","Municipal","Avenida 01 Quadra 17, Lote 8, 26","Centro","",""
"Bonópolis","Biblioteca Pública Municipal Maria das Graças Afra Borges","Municipal","Avenida Amazonas, s/n","Centro","(62)3393-1285",""
"Brazabrantes","Biblioteca Pública Municipal José Mendonça Telles","Municipal","Rua Aureliano C. Machado, s/n","Centro","(62)3529-1255",""
"Britânia","Biblioteca Pública Municipal de Britânia","Municipal","Avenida Brasília, 365","Centro","(62)3383-1401",""
"Buriti Alegre","Biblioteca Pública Municipal Professora Ales Oliveira Ataídes","Municipal","Praça Agnelo Naves de Souza, s/n","Centro","",""
"Buriti de Goiás","Biblioteca Pública Municipal Caminho do Saber","Municipal","Avenida Deputado Sólon Amaral, s/n","Centro","(64)3699-1252",""
"Buritinópolis","Biblioteca Pública Municipal Cora Coralina","Municipal","Avenida Buriti, s/n","Centro","(61)3406-1106",""
"Cabeceiras","Biblioteca Pública Municipal de Cabeceiras","Municipal","Setor Mariano Machado","Centro","",""
"Cachoeira Alta","Biblioteca Pública Municipal Maria Alves Goulart","Municipal","Praça Adelino de Oliveira, 116","Centro","",""
"Cachoeira de Goiás","Biblioteca Pública Municipal Adanair Alves de Rezende","Municipal","Praça Vereadror Orozimbo Vieira de Souza, s/n","Centro","(64)3676-1122",""
"Caçu","Biblioteca Pública Municipal Lazinho Pintado","Municipal","Avenida Idelfonso Carneiro, s/n","Centro","(64)3656-6012",""
"Caiapônia","Biblioteca Pública Municipal Sebastião Pereira da Silva","Municipal","Avenida Lindolfo Alves Dias, s/n","Centro","(64)3663-1025",""
"Caldas Novas","Biblioteca Pública Municipal Professor Josino Ferreira Brito","Municipal","Centro de Assitência Municipal (CAM)","Centro","(64)3454-3521",""
"Campestre de Goiás","Biblioteca Pública Municipal Professor Manuel Maia","Municipal","Avenida São João, s/n","Centro","(62)3557-1582",""
"Campinaçu","Biblioteca Pública Municipal de Campinaçu","Municipal","Avenida 17 de Setembro, 18","Centro","(62)3377-3248",""
"Campo Alegre de Goiás","Biblioteca Pública Municipal Benedita Lisboa Castro","Municipal","Praça Coronel João Vaz, s/n","Centro","(64)3696-1464",""
"Campo Limpo de Goiás","Biblioteca Pública Municipal de Campo Limpo de Goiás","Municipal","Avenida Baltazar Cardoso, s/n","Centro","(62) 3345-1241",""
"Campos Belos","Biblioteca Pública Municipal de Campos Belos de Goiás","Municipal","Avenida Joaquim Selino, s/n","Centro","(62) 3664-1242",""
"Campos Verdes","Biblioteca Pública Municipal Bernardo Elis","Municipal","Avenida Principal, s/n","Centro","6233516644",""
"Carmo do Rio Verde","Biblioteca Pública Municipal de Carmo do Rio Verde","Municipal","Avenida Coronel José Teodoro, 53","Centro","6233376896",""
"Castelândia","Biblioteca Pública Municipal Professora Roseli Terezinha de Abreu","Municipal","","","",""
"Catalão","Biblioteca Pública Municipal Doutor Luiz Alcântara de Oliveira","Municipal","Avenida 20 de Agosto, 1900","Centro","6234423998",""
"Cavalcante","Biblioteca Pública Municipal Padre Geraldo","Municipal","Rua 13, Quadra 45, Lote. 510","Cavalcantinho","6234941270",""
"Ceres","Biblioteca Pública Municipal Joel da Silva Morais","Municipal","Praça João Pedrosa, s/n","Centro","6233072070",""
"Cezarina","Biblioteca Pública Municipal Érico Ramos de Oliveira","Municipal","Rua 6, Quadra 17","Vila Calândia","",""
"Chapadão do Céu","Biblioteca Pública Municipal Alberto Rodrigues da Cunha","Municipal","Avenida Ema, s/n, Quadra-52","Centro","6436341243",""
"Cidade Ocidental","Biblioteca Pública Municipal José Sarney","Municipal","Sq 13 Quadra 4 Lote 3","Centro","",""
"Cocalzinho de Goiás","Biblioteca Pública Municipal Dona Agnes Chagas","Municipal","Rua 10, Quadra 23, Lote 04","Centro","6233391043",""
"Colinas do Sul","Biblioteca Pública Municipal de Colinas do Sul","Municipal","Rua Belo Horizonte, s/n","Setor 1","6299119939",""
"Córrego do Ouro","Biblioteca Pública Municipal Olavo Bilac","Municipal","Praça Do Cordeiro, 40","Centro","",""
"Corumbá de Goiás","Biblioteca Pública Municipal Monsenhor Chiquinho","Municipal","Rua São Bento, 473","Centro","",""
"Corumbaíba","Biblioteca Pública Municipal de Corumbaíba","Municipal","Avenida Barão do Rio Branco","Centro","(64) 3447-7050",""
"Cristalina","Biblioteca Pública Municipal Magda Faraj Santana -  Santana Farage","Municipal","Rua Juiúti Q 11 Lt 12","Setor Oeste","6136126434",""
"Cristianópolis","Biblioteca Pública Municipal Antônio Machado de Sousa","Municipal","Rua José Abdala, s/n","Centro","6439328002",""
"Crixás","Biblioteca Pública Municipal de Crixás","Municipal","Praça Germano Francisco de Oliveira, s/n","Vila Nova","6233652000",""
"Cumari","Biblioteca Pública Municipal Professor Serafim de Melo Agapito","Municipal","Praça da Matriz, s/n","Centro","6434401550",""
"Damianópolis","Biblioteca Pública Municipal Cecília Meireles","Municipal","Avenida Goiás, 439","Centro","(62) 3445-1208",""
"Davinópolis","Biblioteca Pública Municipal de Davinópolis","Municipal","Rua Dorcília Cândida de Jesus, 02","Centro","",""
"Diorama","Biblioteca Pública Municipal Maria Clemência Mendes e Silva Santos","Municipal","Avenida Deputado José de Assis, s/n","Centro","6436891101",""
"Divinópolis de Goiás","Biblioteca Pública Municipal Padre Geraldo Chiarine Ferraciolli","Municipal","Praça São João, s/n","Centro","6234561100",""
"Doverlândia","Biblioteca Pública Municipal Cora Coralina","Municipal","Avenida Joaquim Firmino de Carvalho, s/n","Centro","(64) 3664-2196",""
"Edealina","Biblioteca Pública Municipal José Balduíno de Moura","Municipal","Rua Dezesseis, 95","Centro","6434801370",""
"Não identificado","Biblioteca Pública Municipal Pedro José Leão","Municipal","Rua 16, 95","Centro","6434801370",""
"Edéia","Biblioteca Pública Municipal","Municipal","Praça João Esteves Rodrigues, s/n","Centro","",""
"Estrela do Norte","Biblioteca Pública Municipal Olavo Bilac","Municipal","Avenida Bernardo Sayão, s/n","Centro","6233816224",""
"Faina","Biblioteca Pública Municipal Bernardo Élis","Municipal","Avenida Albion Barros Curado, 303","Centro","",""
"Fazenda Nova","Biblioteca Pública Municipal Padre Acácio Pina Neto","Municipal","Avenida Goiás, 600","Centro","6233821245",""
"Firminópolis","Biblioteca Pública Municipal de Fiminópolis","Municipal","Avenida Vitoriano Borges Naves, s/n","Centro","6436812366",""
"Flores de Goiás","Biblioteca Pública Municipal","Municipal","Praça da Matriz, 44","Centro","6234481440",""
"Formosa","Biblioteca Pública Municipal Rubens Ribeiro da Costa","Municipal","Rua 10, 70","Formosinha","6199368422",""
"Não identificado","Biblioteca Pública Municipal Bárbara Messias de Souza","Municipal","Praça do Pau Ferro, s/n","Centro","6139811135",""
"Não identificado","Biblioteca Pública Municipal Central","Municipal","Rua José Viana Lobo, 443","Centro","6198398545",""
"Não identificado","Biblioteca Pública do CEU das Artes","Municipal","Rua 65, s/n","Parque Lago","(61) 2108- 7462","clarissa.siqueira@caixa.gov.br"
"Formoso","Biblioteca Pública Municipal Teotônio Vilela","Municipal","Avenida Ministro Alfredo Nasser, 1327","Centro","6291757459",""
"Gameleira de Goiás","Biblioteca Ana Umbelino dos Santos ","Municipal","Avenida das Palmeiras, s/n ","","(62) 3322-3164",""
"Goianápolis","Biblioteca Pública Municipal Izanildo Pedro Garcia","Municipal","Avenida Carlos de Pina, 305","Centro","6233412086",""
"Goiandira","Biblioteca Pública Municipal Professora Miralice de Melo","Municipal","Rua Simplício Martins, 02","Centro","6434627017",""
"Goianésia","Biblioteca Pública Municipal Inácio de Araújo Godinho","Municipal","Rua 20, 312","Centro","6239351099",""
"Goiânia","Biblioteca Pública Municipal Cora Coralina","Municipal","Avenida 24 de Outubro, 120","Bairo Leste Universitário","6235241975",""
"Não identificado","Biblioteca Pública Municipal Marieta Telles Machado","Municipal","Praça Universitária, s/n","Campinas","6235241786",""
"Não identificado","Biblioteca Pública Estadual Pio Vargas","Estadual","Praça Cívica, 02","Centro","(62) 3201-4653",""
"Goianira","Biblioteca Pública Municipal de Goianira","Municipal","Avenida Goiás, s/n","Centro","6235167009",""
"Goiás","Biblioteca Pública Municipal Benedito Rua Sardinha da Costa","Municipal","Avenida Dario de Paiva, s/n","João Francisco","6233717706",""
"Goiatuba","Biblioteca Pública Municipal Doutor Andrade","Municipal","Rua Araguaia, 230","Centro","6434950038",""
"Gouvelândia","Biblioteca Pública Municipal Bruno Rafael dos Santos","Municipal","Avenida João de Oliveira Gouveia, s/n","","",""
"Guapó","Biblioteca Pública Municipal de Guapó","Municipal","Rua Rodolfo Tavares, s/n","","",""
"Guaraíta","Biblioteca Pública Municipal de Guaraíta","Municipal","Rua da Mangueira, s/n","Centro","6233383151",""
"Guarani de Goiás","Biblioteca Pública Municipal de Guarani de Goiás","Municipal","Avenida Savage Alves de Oliveira, s/n","Centro","6234491187",""
"Guarinos","Biblioteca Pública Municipal de Guarinos","Municipal","Rua Juscelino Gomes de Oliveira, s/n","Centro","(62) 3341-6134",""
"Heitoraí","Biblioteca Pública Municipal Normi Lucia da Costa","Municipal","Rua Paula, s/n","Centro","(62)9265-0086",""
"Hidrolândia","Biblioteca Pública Municipal Merietta Teles machado","Municipal","Praça do Cruzeiro","","",""
"Hidrolina","Biblioteca Pública Municipal Helvétio Ferreira de Melo","Municipal","Rua Manoel de Oliveira Pena, 27","Centro","(62) 3349-6700",""
"Iaciara","Biblioteca Pública Municipal de Jaciara","Municipal","Rua Marechal Dutra, s/n","Centro","6296659744",""
"Inaciolândia","Biblioteca Pública Municipal de Inaciolândia","Municipal","Rua Juvercina Cortez, s/n","Centro","",""
"Indiara","Biblioteca Pública Municipal Abel Leite da Silva","Municipal","Rua Dona Similiana Alves Leite, s/n","Centro","",""
"Inhumas","Biblioteca Pública Municipal Nadir Arataque","Municipal","Praça Santana, s/n","Centro","6235112121",""
"Não identificado","Biblioteca Pública Municipal Moacir José Reis","Municipal","Praça Aberlardo Vaz Costa, s/n","Vila Operária","6235143538",""
"Ipameri","Biblioteca Pública Municipal João Veiga","Municipal","Rua Artur Silvério da Silva, s/n","Centro","6434916021",""
"Ipiranga de Goiás","Biblioteca Pública Municipal Ipiranga de Goiás","Municipal","Avenida Ceres, Q. 6 Lt. 06","Centro","6233426145",""
"Iporá","Biblioteca Pública Municipal Professora Milca de Souza Santos","Municipal","Avenida Doutor Netto, 03","Centro","6436037254",""
"Israelândia","Biblioteca Pública Municipal de Israelândia","Municipal","Rua Melquíades Antônio Claudio, 244","Centro","",""
"Itaberaí","Biblioteca Pública Municipal Dona Eva Vieira Almeida","Municipal","Avenida 15, s/n","Centro","6296998939",""
"Itaguari","Biblioteca Pública Municipal Pedro Procópio de Oliveira","Municipal","Rua 4 , 63","Centro","",""
"Itaguaru","Biblioteca Pública Municipal Dom Pedro I","Municipal","Avenida Benigno Pinto Faria, s/n","Centro","6233981300",""
"Não identificado","Biblioteca Pública Municipal Pedro Moreira Damasceno","Municipal","Avenida Lúcio Pimenta Neves, 1031","Centro","6292168072",""
"Itajá","Biblioteca Pública Municipal de Itajá","Municipal","Rua Pio C. de Medeiros, s/n","Centro","6436487016",""
"Itapaci","Biblioteca Pública Municipal de Itapaci","Municipal","Rua Pilar, 20","Centro","",""
"Itapirapuã","Biblioteca Pública Municipal de Itapirapuã","Municipal","Praça Túlio Varnes Pacheco, s/n","Centro","6233741221",""
"Itapuranga","Biblioteca Pública Municipal de Itapuranga","Municipal","Rua 34, 47","Centro","6296735493",""
"Itarumã","Biblioteca Pública Municipal Ana Diolina Peres de Assis","Municipal","Rua 15,de março, s/n","Centro","6436591610",""
"Itauçu","Biblioteca Pública Municipal de Itauçu","Municipal","Praça Ilete Bueno, 285","Centro","",""
"Itumbiara","Biblioteca Pública Municipal de Itumbiara","Municipal","Avenida J.K, 1010","Centro","6434316957",""
"Ivolandia","Biblioteca Professora Lureth Mendes Ribeiro Augusto ","Municipal","Rua Deputado Jamel Cecílio, 192 ","Centro","(64) 3685-1142",""
"Jandaia","Biblioteca Pública Municipal Jandáia","Municipal","Rua José Farias Campos, 122","Centro","6435632022",""
"Jaraguá","Biblioteca Pública Municipal Desembargador Augusto Ferreira Rios","Municipal","Praça Silvio de C. Ribeiro, s/n","Centro","6233261324",""
"Jataí","Biblioteca Pública Municipal Dante Mosconi","Municipal","Avenida Goiás, s/n","Centro","6436324140",""
"Jaupaci","Biblioteca Pública Municipal José Alves de Assis","Municipal","Rua Guarda Mor, s/n","Centro","",""
"Jesúpolis","Biblioteca Pública Municipal Maria Lino Teixeira","Municipal","Rua 4, s/n","Centro","6233591188",""
"Joviânia","Biblioteca Pública Municipal de Joviânia","Municipal","Rua Paulo Pepp, s/n","Centro","6434087015",""
"Jussara","Biblioteca Pública Municipal Maria Corsina de Lima","Municipal","Avenida Marechal Rondon, s/n","Centro","6233733933",""
"Lagoa Santa","Biblioteca Pública Municipal de Lagoa Santa","Municipal","Rua Valdomiro Teodoro Rios, s/n","Pousada das Nascentes","6436401268",""
"Leopoldo de Bulhões","Biblioteca Pública Municipal Leopoldo de Bulhões","Municipal","Rua José Pires, s/n","Centro","6233371852",""
"Luziânia","Biblioteca Pública Municipal Professora Laíssa dos Reis Meireles","Municipal","Praça Nirson Carneiro Lobo","Centro","6139063498",""
"Mairipotaba","Biblioteca Pública Municipal Hermínio Pereira de Freitas","Municipal","Rua Alameda das Flores, s/n","Centro","",""
"Mambaí","Biblioteca Pública Municiapal João Mendes Teixeira","Municipal","Avenida Castelo Branco, s/n","Centro","(62) 9963-2311",""
"Mara Rosa","Biblioteca Pública Municipal Guimarães Rosa","Municipal","Praça José Maurício de Moura, s/n","Centro","6233661890",""
"Marzagão","Biblioteca Pública Municipal de Marzagão","Municipal","Rua Sete de setembro, s/n","Centro","",""
"Matrinchã","Biblioteca Pública Municipal de Matrinchã","Municipal","Avenida João Artiaga, s/n","Central","6434501715",""
"Maurilândia","Biblioteca Pública Municipal Vermundo Alves de Freitas","Municipal","Avenida Amazonas, s/n","Centro","6436477110",""
"Mimoso de Goiás","Biblioteca Pública Municipal Mimoso de Goiás","Municipal","Avenida dos Bandeirantes, s/n","Centro","6234631306",""
"Minaçu","Biblioteca Pública Municipal Hernani Farias","Municipal","Rua 1, s/n","Jardim Primavera","6233791421",""
"Mineiros","Biblioteca Pública Municipal Irmã Maria de Lourdes","Municipal","5.ª Avenida, s/n","Centro","6236610091",""
"Moiporá","Biblioteca Pública Municipal José Conceição dos Sa","Municipal","Avenida José Masqueline, s/n","Centro","(64) 3686-1118",""
"Monte Alegre de Goiás","Biblioteca Pública Municipal Omezino Galvão Pereira","Municipal","Praça da Matriz de Santo Antônio, 2","Centro","(62) 3457-1334",""
"Montes Claros de Goiás","Biblioteca Pública Municipal Firmino Barbosa Franco","Municipal","Avenida Belmiro Nogueira da Silva, s/n","Centro","",""
"Montividiu","Biblioteca Pública Municipal Conrado Camilo Cruvinel","Municipal","Rua 5 Qd 8 Lt 6 Nº 275","Centro","6436291240",""
"Montividiu do Norte","Biblioteca Pública Municipal de Montividiu","Municipal","Rua Rita Cândida de Jesus, s/n","Centro","6233846278",""
"Morrinhos","Biblioteca Pública Municipal Professor José Cândido","Municipal","Rua Piauí, s/n","Centro","6434172077",""
"Morro Agudo de Goiás","Biblioteca Pública Municipal Morro Agudo de Goiás","Municipal","Rua Lírio do Vale, 769","Centro","6233343144",""
"Mossâmedes","Biblioteca Pública Municipal Mossamedes","Municipal","Avenida João Ferreira da Cunha, s/n","Centro","6433771523",""
"Mozarlândia","Biblioteca Pública Municipal de Mozarlandia","Municipal","Avenida José Camelo, s/n","Centro","(62) 3348-7637","educacao.mozar@hotmail.com"
"","Biblioteca Livro Aberto","Municipal","","","",""
"Mundo Novo","Biblioteca Pública Municipal Alvino de Freitas","Municipal","Avenida Tamboris, s/n","São Lourenço","6233913240",""
"Mutunópolis","Biblioteca Pública Municipal João Teodoro de Oliveira","Municipal","Rua 7 de Setembro, s/n","Centro","6233826375",""
"Nazário","Biblioteca Pública Municipal de Nazário","Municipal","Praça da Bandeira, 46","Centro","6436801220",""
"Nerópolis","Biblioteca Pública Municipal Adolvano Gomes da Silva","Municipal","Rua Josefina Ludovico de Almeida, s/n","Centro","6235131307",""
"Niquelândia","Biblioteca Pública Municipal de Niquelândia","Municipal","Avenida Brasil, 65","Belo Horizonte","6281521238",""
"Nova América","Biblioteca Pública Municipal Nova América","Municipal","Avenida Antônio de Oliveira, 25","Centro","6233456271",""
"Nova Aurora","Biblioteca Pública Municipal João Cândido da Silva Neto","Municipal","Rua Bahia, 60","Centro","6436981701",""
"Nova Crixás","Biblioteca Pública Municipal de Nova Crixás","Municipal","Praça Três Poderes, s/n","Laranjeiras","6233853919",""
"Novo Gama","Biblioteca Pública Novo Gama ","Municipal ","Rua Sem Nome, Quadra 104, L. A/E, S/SN -BP Jardim Lago Azul","Jardim Lago Azul ","99123-0469/ 36281008",""
"Nova Glória","Biblioteca Pública Municipal Professor Orestes Roberto Vaz","Municipal","Rua Sargento Leontino, s/n","Centro","6233453615",""
"Nova Iguaçu de Goiás","Biblioteca Pública Municipal Tancredo Neves","Municipal","Rua Tancredo Neves, 77","Centro","(61)981524437",""
"Nova Roma","Biblioteca Pública Municipal de Nova Roma","Municipal","Praça Augusto Pio, 01","Centro","6234821153",""
"Nova Veneza","Biblioteca Pública Municipal Professor José Passos","Municipal","Praça João Stival, s/n","Centro","6233561149",""
"Novo Brasil","Biblioteca Pública Municipal Professora Emília F. de Oliveira","Municipal","Avenida Joaquim Pacheco de Macedo, s/n","Centro","6233811305",""
"Novo Gama","Biblioteca Pública Municipal Castro Alves","Municipal","Área Especial 1000","Centro","6136284495",""
"Novo Planalto","Biblioteca Pública Municipal José Dias Mota","Municipal","Rua Goiânia, s/n","Centro","",""
"Orizona","Biblioteca Pública Municipal Maurity Silva","Municipal","Praça Doutor Pila s/n","Centro","6434741493",""
"Ouro Verde de Goiás","Biblioteca Pública Municipal José Faustino dos Santos","Municipal","Praça Do Rosário, s/n","Centro","6292181351",""
"Ouvidor","Biblioteca Professora Elvídia Mendes dos Santos ","Municipal","Avenida Antonio Torquato, s/n ","Centro","",""
"Padre Bernardo","Biblioteca Pública Municipal Padre Bernardo","Municipal","Rua Getúlio Vargas, 225","Centro","6136331251",""
"Palestina de Goiás","Biblioteca Pública Municipal Maria Joana de Bastos","Municipal","Avenida Bastos, 731","Centro","6436621230",""
"Palmeiras de Goiás","Biblioteca Pública Municipal Geraldino Franco da Costa","Municipal","Rua Americano do Brasil, 149","Centro","6439544023",""
"Palmelo","Biblioteca Pública Municipal de Palmelo","Municipal","","","",""
"Palminópolis","Biblioteca Pública Municipal Adete Evaristo Amorim","Municipal","Rua Deputado Antônio de Queiroz Barreto, s/n","Centro","6436751167",""
"Panamá","Biblioteca Pública Municipal Emílio Ribas","Municipal","Avenida Itumbiara, s/n","Centro","6434791200",""
"Paranaiguara","Biblioteca Pública Municipal Joaquim Marques Sá","Municipal","Rua Orcar Bernardes, s/n","Centro","6436550127",""
"Paraúna","Biblioteca Pública Municipal Margarida Concórdia da Silva","Municipal","Avenida Rogério Gomes, 09","Centro","6435567026",""
"Perolândia","Biblioteca Pública Municipal Professora Vitorina","Municipal","Rua Izarías Beraldo, s/n","Centro","6436391319",""
"Petrolina de Goiás","Biblioteca Pública Municipal Madalena Gonçalves da Silva","Municipal","Praça Teófilo Vieira Motta, 101","Centro","",""
"Pilar de Goiás","Biblioteca Pública Municipal Jacob Amorim","Municipal","Praça da Carvalhada, 401","Centro","6233393292",""
"Piracanjuba","Biblioteca Pública Municipal de Piracanjuba","Municipal","Praça da Bandeira, 01","Centro","6434054064",""
"Piranhas","Biblioteca Pública Municipal de Piranhas","Municipal","Avenida Independência, s/n","Centro","6436657013",""
"Pirenópolis","Biblioteca Pública Municipal Isócrates de Oliveira","Municipal","Avenida Benjamin Constant, 21","Centro","6233313709",""
"Pires do Rio","Biblioteca Pública Municipal Cylenio de Araújo","Municipal","Praça Francisco Felipe Machado, s/n","Centro","6434614062",""
"Planaltina","Biblioteca Pública Municipal Cora Coralina","Municipal","Quadra C-03, Lt 25","Setor Oeste","6136771656",""
"Pontalina","Biblioteca Pública Municipal Sarai Bonifácio de Oliveira","Municipal","Praça Alfredo Nasser, s/n","Centro","(64)3471-1871",""
"Porangatu","Biblioteca Pública Municipal Professora Ana Braga","Municipal","Praça Ângelo Rosa, s/n","Centro","6233625049",""
"Porteirão","Biblioteca Pública Municipal Santa Genoveva ","Municipal","Rua Rioturvo, Quadra 46, lote 501, Setor central, sala 2","Centro","( 64) 3643-1144",""
