"MUNICÍPIO","NOME DA BIBLIOTECA","VÍNCULO","ENDEREÇO","BAIRRO","TELEFONE","E-MAIL"
"Afogados da Ingazeira","Biblioteca Pública Municipal Monsenhor Alfredo Arruda Câmara","Municipal","Rua Barão de Lucemar, s/n","Centro","(87)3838-1235/1282",""
"Afrânio","Biblioteca Pública Municipal Semidocéia da Silva Cavalcante","Municipal","Praça Sebastião Coelho, s/n","Centro","(87) 8839-4767/3868-1054",""
"Agrestina","Biblioteca Pública Municipal Cônegoo Adalberto Damasceno","Municipal","Rua Virgínia Torres, 131","Centro","8137442276",""
"Água Preta","Biblioteca Pública Municipal Cientista Nelson Chaves","Municipal","Praça dos Três Poderes, 3280","Centro","8187589543",""
"Águas Belas","Biblioteca Pública Municipal Elcy de Araújo Malta","Municipal","Avenida Coronel Alfredo Duarte","Centro","",""
"Alagoinha","Biblioteca Pública Municipal Maria das Dores Antunes Galindo","Municipal","Avenida Gonçalo Antunes de Oliveira, s/n","Centro","8188332711",""
"Aliança","Biblioteca Pública Municipal Professor Sílvio Rabelo","Municipal","Rua Siqueira Campos, s/n","Centro","8196322967",""
"Altinho","Biblioteca Pública Municipal Luiz Pessoa de Oliveira","Municipal","Praça Júlio Rodrigues Filho, 62","Centro","8199496336",""
"Amaraji","Biblioteca Pública Municipal Dom Carlos Coelho","Municipal","Rua Comendador José Pereira de Araújo, s/n","Centro","8135531323",""
"Angelim","Biblioteca Pública Municipal Josefa de Oliveira Borba","Municipal","Rua Francisco Bezerra dos Santos, s/n","Centro","8737881156",""
"Araçoiaba","Biblioteca Pública Municipal Ariano Suassuna","Municipal","Rua Antônio Carneiro, s/n","Centro","",""
"Araripina","Biblioteca Pública Municipal Antonieta Salatiel Alencar Arraes","Municipal","Rua José Barreto de Souza Sombra, 143","Centro","",""
"Arcoverde","Biblioteca Pública Municipal Professora Marina Magalhães","Municipal","Avenida Pedro II, s/n","Centro","8791616515",""
"Barra de Guabiraba","Biblioteca Pública Municipal Doutor Mário Pereira de Lucena","Municipal","Praça Carlos Augusto Alves de Araújo, s/n","Centro","8191581672",""
"Barreiros","Biblioteca Pública Municipal Júlio Belo","Municipal","Rua Olímpio Teodoro, s/n","Centro","8187494125",""
"Belém de Maria","Biblioteca Pública Municipal Joaquim Nabuco","Municipal","Rua Capitão José de Gouveia, s/n","Centro","8136861153",""
"Belém do São Francisco","Biblioteca Pública Municipal Professor Manoel Costa Cavalcante","Municipal","Rua Coronel Trapiá, 180","Centro","8738761591",""
"Belo Jardim","Biblioteca Pública Municipal Professora Isabel Ferreira","Municipal","Rua Major Maciel, 42","Centro","8137268711",""
"Betânia","Biblioteca Pública Municipal Jerônimo de Souza Neto","Municipal","Praça da Bandeira, s/n","Centro","8738521156",""
"Bezerros","Biblioteca Pública Municipal Vereador José Santiago Filho","Municipal","Rua Henrique Dias, s/n","Santo Antônio","8137286704",""
"Bodocó","Biblioteca Pública Municipal Vidalina Gomes da Silva","Municipal","Rua Cícero Bezerra, s/n","Centro","",""
"Bom Conselho","Biblioteca Pública Municipal de Bom Conselho","Municipal","Praça Frei Caetano de Messina, s/n","Centro","8737714706",""
"Bom Jardim","Biblioteca Pública Municipal João Moura  Cavalcanti","Municipal","Praça Barão de Lucena, s/n","Centro","8136381156",""
"Bonito","Biblioteca Pública Municipal Professora Maria do Carmo de Menezes","Municipal","Rua Esmeraldino Bandeira, s/n","Centro","8137371468",""
"Brejão","Biblioteca Pública Municipal Manoel Goes Sobrinho","Municipal","Praça Vereador José Augusto Pinto ","Centro  ","",""
"Brejinho","Biblioteca Pública Municipal Manoel Nunes Ferreira","Municipal","Rua São Sebastião, 4","Centro","8738501156",""
"Brejo da Madre de Deus","Biblioteca Pública Municipal Marechal Humberto de Alencar Castelo Branco","Municipal","Rua Maestro Tomás de Aquino, 3","Centro","8137471259",""
"Brejo da Madre de Deus-Fazenda Nova","Biblioteca Pública Municipal Maria Margarida Mendonça Brasileiro","Municipal","Rua Soares da Costa, 22","Centro","8199200965",""
"Buenos Aires","Biblioteca Púbica Municipal de Buenos Aires","Municipal","Rua Major Severino Mendes s/n","Centro","(81) 3647-1167",""
"Buíque","Biblioteca Municipal Graciliano Ramos","Municipal ","Praça Nonô Camelo s/n ","Centro","(87) 3855-2909",""
"Cabo de Santo Agostinho","Biblioteca Pública Municipal Joaquim Nabuco","Municipal","Avenida Historiador Pereira da Costa, s/n","Centro","8135249202",""
"Cabrobó","Biblioteca Pública Municipal Pedro Cavalcante Leão","Municipal","Avenida São Francisco, 487","Centro","8799183122",""
"Cachoeirinha","Biblioteca Pública Municipal Alfredo Alves de Espíndola","Municipal","Avenida Santo Antônio, 62","Centro","8137421156",""
"Caetés","Biblioteca Pública Municipal Luiz Brasil","Municipal","Avenida Luís Pereira Júnior, 23","Centro","",""
"Calçado","Biblioteca Pública Municipal de Calçado","Municipal","Rua Dantas Barreto, 147","Centro","8137931255",""
"Camaragibe","Biblioteca Pública Municipal de Camaragibe","Municipal","","Vila da Fábrica","(81) 3458-1891 ","twitter: @Bpenarol / facebook: https://www.facebook.com/bibliotecamunicipal.penarol"
"Camocim de São Félix","Biblioteca Pública Municipal Professora Leurídia Paixão de Melo","Municipal","Praça São Félix, s/n","Centro","(81) 3743-1156",""
"Camutanga","Biblioteca Pública Municipal de Camutanga Procurador Pedro Jorge de Melo e Silva  ","Municipal","Rua Santa Cruz,  s/n","Centro","(81) 3652-1162","camutangaeduc@yahho.com.br"
"Canhotinho","Biblioteca Pública Municipal Costa Porto ","Municipal","Rua Doutor Afonso Pena, s/n ","Centro","(81) 781-1299 ",""
"Capoeiras","Biblioteca Pública Municipal Álvaro Rocha","Municipal","Praça João Burrego, 176","Centro","(81) 3796-1092",""
"Carnaíba","Biblioteca Pública Municipal Professora Maria Salomé Veloso da Silva","Municipal","Rua Otacílio Gomes, s/n","Centro","(87) 3854-1156",""
"Carnaubeira da Penha","Biblioteca Pública Municipal Professora Antônia Lopes da Silva","Municipal","Travessa Manoel Freire da Silva, 148","Centro","",""
"Carpina","Biblioteca Pública Municipal Doutor Geraldo Calábria Lapenda","Municipal","Praça Lourival da Silva Bastos, s/n","Centro","(81) 3622-0607",""
"Caruaru","Biblioteca Pública Municipal Álvaro Lins  ","Municipal","Rua Geraldo Luiz Damasceno, 11","Maria Auxiliadora","",""
"Casinhas","Biblioteca Pública Municipal Giselda Barbosa da Silva","Municipal","Rua Maria Cecília de Miranda, s/n","Centro","",""
"Catende","Biblioteca Pública Municipal Manoel Martins Júnior","Municipal","Rua Bela Aurora, s/n","Centro","8136731481",""
"Cedro","Biblioteca Pública Municipal Professora Maria Socorro Gomes","Municipal","Rua Francisco Filgueira Sampaio, 241","Centro","",""
"Chã de Alegria","Biblioteca Pública Municipal Severina Francisca da Silva","Municipal","Rua João Pessoa, s/n","Centro","8135811390",""
"Chã Grande","Biblioteca Pública Municipal João Prudente de Santana","Municipal","Rua João Batista de Vasconelos, s/n","Centro","8135331140",""
"Condado","Biblioteca Pública Municipal Cecília Corrêa de Oliveira","Municipal","Avenida Olegário Fonseca, s/n","Centro","8136421496",""
"Correntes","Biblioteca Pública Municipal Ananias Calado","Municipal","Praça Pedro Alves Camelo, s/n","Centro","8737721158",""
"Cortês","Biblioteca Pública Municipal Maria do Carmo Medeiros Braga","Municipal","Rua Carlos de Barros Cavalcante, 108","Centro","8136871151",""
"Cumaru","Biblioteca Pública Municipal de Cumaru Maria da Conceição Go....","Municipal","Rua João de Moura Borba","","",""
"Cupira","Biblioteca Pública Municipal Maria Luiza de Amorim","Municipal","Rua José Veríssimo de Souza, s/n","Centro","8187029318",""
"Dormentes","Biblioteca Pública Municipal Alcino Rodrigues de Albuquerque","Municipal","Rua Francisco Modesto Cavalcanti, s/n","Centro","8738651479",""
"Escada","Biblioteca Pública Municipal Professor Eraldo Campos","Municipal","Rua Barão de Jundiá, 158","Centro","8135344025",""
"Exu","Biblioteca Pública Municipal Alvenir Peixoto","Municipal","Rua Urbano Peixoto, s/n","Centro","8738791210",""
"Feira Nova","Biblioteca Pública Municipal Iracilda Bezerra da Rocha","Municipal","Rua Jose de Barros, 82B","Garagem","",""
"Fernando de Noronha","Biblioteca Pública Distrital Heleno Armado","Distrital","BR 363, Floresta Velha, s/n","Fernando de Noronha","",""
"Ferreiros","Biblioteca Pública Municipal Monsenhor José Marques da Fonseca","Municipal","Rua Pedro Santos Estima, 192","Centro","8136571156",""
"Flores","Biblioteca Pública Municipal Monsenhor Pinto de Campos","Municipal","Rua Doutor Tito Rosas, s/n","Centro","8738571313",""
"Floresta","Biblioteca Pública Municipal Belmira Ferraz","Municipal","Praça Crispim Hipólito, s/n","Centro","8796171357",""
"Frei Miguelinho","Biblioteca Pública Municipal Joaquim Nabuco","Municipal","Avenida José Barradas, s/n","Centro","",""
"Gameleira","Biblioteca Pública Municipal Doutor José Lúcio de Q. Monteiro","Municipal","Avenida Júlio Brasileiro, s/n","Heliópolis","8136791295",""
"Garanhuns","Biblioteca Pública Municipal Luiz Brasil","Municipal","Rua Djalma Dutra, s/n","Centro","8737619611",""
"Glória do Goitá","Biblioteca Pública Municipal Marechal Cândido Rondon","Municipal","Avenida Marechal Deodoro da Fonsaca, 10","Centro","8196340434",""
"Granito","Biblioteca Pública Municipal de Granito","Municipal","","","",""
"Iati","Biblioteca Pública Municipal Quitiliano -  QuinteleanTenório de Carvalho","Municipal","Avenida Castro Alves, s/n","Centro","8737861156",""
"Ibimirim","Biblioteca Pública Municipal de Ibimirim","Municipal","Rua Padre Manoel Zacarias, s/n","Centro","8738421088",""
"Ibirajuba","Biblioteca Pública Municipal João Dias dos Santos","Municipal","Rua Frei Caneca, 24","Centro","8137941130",""
"Igarassu","Biblioteca Pública Municipal Hercília Bandeira de Melo","Municipal","Rua Bispo Cavalcante, 41","Centro","8135430435",""
"Iguaraci","Biblioteca Pública Municipal de Iguaraci","Municipal","Rua José de B. Pereira, s/n","Centro","8738371156",""
"Não identificado","Biblioteca Pública Municipal de Jabitacá","Municipal","Rua Hermegildo Lima, s/n","Pilar","8738091087",""
"Ilha de Itamaracá","Biblioteca Pública Municipal Antônio Macedo","Municipal","Praça Professora Maria José Sá de Andrade, s/n","Centro","",""
"Inajá","Biblioteca Pública Municipal de Inajá","Municipal","Rua Tenente Domingos Gomes, 115","Centro","8738401169",""
"Ingazeira","Biblioteca Pública Municipal Professora Doralice Pereira de Moraes","Municipal","Rua Aristaque José de Veras, s/n","Centro","8738291102",""
"Ipojuca","Biblioteca Pública Municipal Vereador Alfredo Ferreira de Paula","Municipal","Rua Santo Antônio, s/n","Camela","8192997505",""
"Ipubi","Biblioteca Pública Municipal Professora Toinha Sá","Municipal","Rua Fernando Bezerra, s/n","Centro","8799333059",""
"Itacuruba","Biblioteca Pública Municipal Eneas Alves Cantarelli","Municipal","Rua José Alves Cantarelli, s/n","Centro","8738931142",""
"Itambé","Biblioteca Pública Municipal Monteiro Lobato","Municipal","Rua Major Cláudio Leite de Andrade s/n","Centro","",""
"Itapetim","Biblioteca Pública Municipal Escritor Graciliano Ramos","Municipal","Rua Barão de Itapirama, s/n","Centro","8738531374",""
"Itaquitinga","Biblioteca Pública Municipal Professor Pedro Botelho","Municipal","Rua Marilita Martins, 67","Centro","8136431250",""
"Jaboatão dos Guararapes","Biblioteca Pública Municipal Poeta Benedito Cunha Melo","Municipal","Rua do Quadro, s/n","Centro","8134811047",""
"Jaqueira","Biblioteca Pública Municipal Estela Rita do Rego Barros","Municipal","Avenida José Lopes Siqueira, 246","Centro","8136891156",""
"Jataúba","Biblioteca Pública Municipal de Jataúba","Municipal","","","8137461129",""
"Jatobá","Biblioteca Pública Municipal de Jatobá","Municipal","Avenida Recife, s/n","","(87) 3851-3489","culturaesportejatoba@gmail.com"
"João Alfredo","Biblioteca Pública Municipal Doutor Álvaro Gonçalves da Costa Lima","Municipal","Rua Santiago Costa, 50","Centro","8196122287",""
"Joaquim Nabuco","Biblioteca Pública Municipal Jubal Protásio de Carvalho","Municipal","Avenida Rui Barbosa, s/n","Centro","8191730039",""
"Jucati","Biblioteca Pública Municipal  de Jucati","Municipal","Rua Tancredo Neves, s/n","Centro","8737798103",""
"Jupi","Biblioteca Pública Municipal de Jupi","Municipal","Avenida 11 de Setembro, 72","Centro","8737791164",""
"Jurema","Biblioteca Pública Municipal do Jurema","Municipal","Rua Antônio Francisco da Silva, s/n","Centro","8737951156",""
"Lagoa de Itaenga","Biblioteca Pública Municipal Moisés Barros da Anunciação","Municipal","Rua Capitão Amador Monteiro, s/n","Centro","8136531383",""
"Lagoa do Carro","Biblioteca Pública Municipal José Barbosa de Souza","Municipal","Rua Presidente Kennedy, s/n","Centro","",""
"Lagoa do Ouro","Biblioteca Pública Municipal Castro Alves","Municipal","Rua do Comércio, s/n","Centro","8737851226",""
"Lagoa dos Gatos","Biblioteca Pública Municipal Professor Deoclécio Rua Ferreira de Araújo","Municipal","Rua Mandacaru, 70","Centro","8136921686",""
"Lagoa Grande","Biblioteca Pública Municipal de Lagoa Grande","Municipal","Praça Simpliciano Cardoso, 33","Centro","",""
"Lajedo","Biblioteca Pública Municipal de Lajedo","Municipal","Rua Vigário Joaquim Pinto, 217","Centro","8737734700",""
"Limoeiro","Biblioteca Pública Municipal Doutor Cícero Barreto Coutinho da Silveira","Municipal","Rua Doutor Alberto José Bezerra, s/n","Alvorada","8196453527",""
"Macaparana","Biblioteca Pública Municipal Clóvis Gomes de Andrade","Municipal","Avenida Manoel Pedro de Aguiar, 22","Centro","8136391265",""
"Machados","Biblioteca Pública Municipal de Machados","Municipal","","","8188397047",""
"Manari","Biblioteca Pública de Manari","Municipal","Avenida São Jorge, 14","Centro ","","vando-movie@hotmail.com"
"Maraial","Biblioteca Pública Municipal Antônio Correia de Oliveira ","Municipal","Avenida Salvador Teixeira, s/n ","Centro","(81) 683-1061 ",""
"Mirandiba","Biblioteca Pública Municipal Tereza Diamantina de Carvalho Lucas","Municipal","Rua Francisco Pires s/n ","","(87) 3885-1111",""
"Moreilândia","Biblioteca Pública Municipal de Moreilândia","Municipal","Rua Coronel Romão Sampaio, 103A","Centro","8738911167",""
"Moreno bonança","Biblioteca Pública Municipal Juliana -  Julieta de Hollanda Vasconcelos","Municipal","Rua Ormezinda Verçosa Vasconcelos, 54","Centro","",""
"Moreno","Biblioteca Pública Municipal João Dourado Filho","Municipal","Praça Papa João XXIII, s/n","Centro","",""
"Nazaré da Mata","Biblioteca Pública Municipal Coronel Victor Vieira de Melo","Municipal","Avenida Liberdade, 100","Carmo","8197017097",""
"Olinda","Biblioteca Pública Municipal de Olinda","Municipal","Rua Doutor Albino de Aguiar, s/n","Centro","8133051155",""
"Orobó","Biblioteca Pública Municipal José Geraldo Távora","Municipal","Avenida Prefeito Ulisses de Novaes Bione, s/n","Centro","8136561156",""
"Orocó","Biblioteca Pública Municipal Maria Luiza Agra Ramos Bione","Municipal","Avenida Mascarenhas de Morais, 222","Centro","8738871156",""
"Ouricuri","Biblioteca Pública Municipal Governador Muniz Falcão","Municipal","Rua Fenelon Ferreira, s/n","Centro","",""
"Palmares","Biblioteca Pública Municipal Professor Fenelon Barreto","Municipal","Avenida Desembargador João Paes de Carvalho, s/n","Centro","8136621156",""
"Palmeirina","Biblioteca Pública Municipal José Maria de Miranda","Municipal","Rua Doutor Petronilo Santa Cruz, s/n","Centro","8737911444",""
"Panelas","Biblioteca Pública Municipal ","Municipal","","Vila São José","8136911115",""
"Não identificado","Biblioteca Pública Municipal","Municipal","","Vila São Lázaro","",""
"Não identificado","Biblioteca Pública Municipal","Municipal","","Vila São Lázaro","",""
"Paranatama","Biblioteca Municipal Paranatama","Municipal","Praça João Correia de Assis, s/n","","(87) 3087-1144","cidahildo@hotmail.com"
"Parnamirim","Biblioteca Pública Muncipal Ana Maria Angelim Nogueira","Municipal","","","8738831515",""
"Passira","Biblioteca Pública Municipal de Passira","Municipal","","","",""
"Paudalho","Biblioteca Pública Municipal Jarbas Passarinho","Municipal","Praça João XXIII, 624","Centro","8136361488",""
"Pedra","Biblioteca Pública Municipal Ulisses Diniz Almeida","Municipal","Avenida Pio XII, s/n","Centro","8738581184",""
"Pesqueira","Biblioteca Pública Municipal Luiz de Oliveira Neves","Municipal","Avenida Milvernes Cruz Lima, s/n","Orla Fluvial","8738358720",""
"Petrolândia","Biblioteca Pública Municipal Barão de Mauá","Municipal","Rua Maria Coelho, s/n","Rajada","8738511156",""
"Petrolina","Biblioteca Pública Municipal Cid de Almeida Carvalho","Municipal","Avenida Tancredo Neves, s/n","","(87) 3862-9188 / 9113",""
"Poção","Biblioteca Pública Municipal Prefeito Libertino Avelino das Neves ","Municipal","Avenida Conrado de Andrade, 45 ","Centro","(87) 3834-1475 / (87) 3834-1522 (Recado)","biblioteca.mun.pocao@hotmail.com"
"Pombos","Biblioteca Pública Municipal Josefa de Andrade Silva","Municipal","Rua Capitão Lins Ribeiro, s/n","Centro","8135361230",""
"Primavera","Biblioteca Pública Municipal Noemi Lago de Melo","Municipal","Avenida Dom Expedito Lopes, s/n","Centro","8135621227",""
"Quipapá","Biblioteca Pública Municipal Jornalista Antônio Lisboa Brito","Municipal","Praça Dom Expedito Lopes","Centro","8192785677",""
"Quixaba","Biblioteca Pública Municipal José Xavier Cortez","Municipal","Rua Major Afonso Leal, s/n","Casa Amarela","(87) 3854-8261/8156",""
"Recife","Biblioteca Pública Estadual de Pernambuco","Estadual","Rua João Lira, s/n","Santo Amaro","(81) 3181-2642",""
"Recife(Casa Amarela)","Biblioteca Popular de Casa Amarela","Municipal","Rua Major Afonso Leal, s/n","Casa Amarela","8132324411",""
"Não identificado","Biblioteca Popular de Afogados","Municipal","Rua João Lira, s/n","Afogados","8132322484",""
"Recife (Compaz Eduardo Campos)","Biblioteca Afranio Godoy","Municipal","Avenida Aníbal Benelo s/n ","Alto Sta Terezinha","(81)3449-7706",""
"Recife (Compaz-Ariano Sussuna)","Biblioteca Carlos Percol","Municipal","Avenida General San Martin, 1208","Cordeiro","(81)3225-9400",""
"Riacho das Almas","Biblioteca Pública Municipal Agamenon Magalhães","Municipal","Rua Maria Julia da Mota, s/n","Centro","8137451581",""
"Ribeirão","Biblioteca Pública Municipal José Mariano","Municipal","Avenida Mário Domingues, s/n","Centro","8136711826",""
"Rio Formoso","Biblioteca Pública Municipal Amaro Tavares de Albuquerque","Municipal","Rua Agamenon Magalhães, s/n","Centro","8136781122",""
"Sairé","Biblioteca Pública Municipal Clotilde Dias de Arruda","Municipal","Avenida Coronel José Pessoa, s/n","Centro","",""
"Salgadinho","Biblioteca Pública Municipal Monsenhor Jonas de Menezes ","Municipal","Rua Eloi Pires, 06 ","Centro","","biblioteca.salgadinho@hotmail.com "
"Salgueiro","Biblioteca Pública Municipal Francisco Augusto","Municipal","Rua Francisco de Sá, 221","Centro","8738710532",""
"Saloá","Biblioteca Pública Municipal Presidente Médici","Municipal","Avenida Getúlio Vargas, 14","Centro","8737521150",""
"Sanharó","Biblioteca Pública Municipal de Sanharó","Municipal","Rua Cel Júlio Nunes, 82","Centro","8738361429",""
"Santa Cruz","Biblioteca Pública Municipal de Santa Cruz","Municipal","Avenida 3 de Maio, 140","Centro","(87) 3874-8170",""
"Santa Cruz da Baixa Verde","Biblioteca Pública Municipal de Santa Cruz da Baixa Verde","Municipal","Rua Monsenhor Elizeu Diniz, 211","Centro","8738468149",""
"Santa Cruz do Capibaribe","Biblioteca Pública Municipal Roseli Maria de Queiroz","Municipal","Rua Professora Olindina, s/n","Centro","",""
"Santa Filomena","Biblioteca Pública Municipal Santa Filomena","Municipal","Rua Genésio Marinho Falcão, 214","Centro","(87) 3874-7120",""
"Santa Maria da Boa Vista","Biblioteca Pública Municipal Maria Honória Sampaio Matos","Municipal","Rua Dióscoro de Sá Gonzaga, s/n","Centro","8738691156",""
"Santa Maria do Cambucá","Biblioteca Pública Municipal Raimunda Pereira Barbosa","Municipal","Rua Professor Agripino de Almeida, 304","Centro","",""
"Santa Terezinha","Biblioteca Pública Municipal Professora Maria Lúcia Liberal de Vasconcelos","Municipal","Rua José Romão de Araújo, s/n","Centro","8738591443",""
"São Benedito do Sul","Biblioteca Pública Municipal Professor Agamenon Magalhães","Municipal","Rua João Pessoa, 45","Centro","",""
"São Bento do Una","Biblioteca Pública Municipal Marechal Cândido Rondon","Municipal","Praça da Matriz, s/n","Centro","",""
"São Caetano","Biblioteca Pública Municipal Sizenando Leite de Macedo","Municipal","Travessa Salustiano Ferreira de Lima, s/n","Centro","",""
"São João","Biblioteca Pública Municipal Professor Erasmo Bernardinho Vilela ","Municipal","Avenida Joaquim Pereira dos Santos, s/n ","Centro","(87) 3784-1156",""
"São Joaquim do Monte","Biblioteca Pública Municipal Monsenhor José Escorel de Araújo","Municipal","Avenida Estácio Coimbra, s/n","Centro","8196633717",""
"São José da Coroa Grande","Biblioteca Pública Municipal Mário de Albuquerque Santos","Municipal","Praça Constantino Gomes, s/n","Centro","8136881386",""
"São José do Belmonte","Biblioteca Pública Municipal Joaquim Nabuco","Municipal","","","(87) 9941-2182",""
"São José do Egito","Biblioteca Pública Municipal Eliete Veras","Municipal","Rua Ana Marisa, s/n","Pajeú","8738441050",""
"São Lourenço da Mata","Biblioteca Pública Municipal Clodoaldo Gomes de Araujo","Municipal","Rua Joaquim Nabuco,158 (rua do Rosário)","","(81) 3525-2749",""
" São Vicente Ferrer","Biblioteca Pública Municipal de São Vicente Ferrer","Municipal","","","",""
"Serra Talhada","Biblioteca Pública Municipal Vereador Cícero Moreira","Municipal","Rua Inoque de Oliveira","Centro","8738311002",""
"Serrita","Biblioteca Pública Municipal Maria Edelsuíte de Jesus Souza","Municipal","Rua Francisco Xavier, s/n","Centro","8738821156",""
"Sertânia","Biblioteca Pública Municipal Professor Ubirajara de Azevedo Chaves","Municipal","Avenida Agamenon  Magalhães, 273","Centro","8738410707",""
"Sirinhaém","Biblioteca Pública Municipal José Clodoaldo de França","Municipal","Rua Sebastião Chaves, s/n","Centro","8135771188",""
"Solidão","Biblioteca Pública Municipal Antônia Filomena Oliveira","Municipal","Rua Joaquim Vieira de Melo, s/n","Centro","8738301140",""
"Surubim","Biblioteca Pública Municipal","Municipal","Rua Estácio Coimbra, 344","Centro","",""
"Tabira","Biblioteca Pública Municipal Quitéria Cordeiro Pessoa","Municipal","Praça Gonçalo Gomes, 50","Centro","8738471511",""
"Tacaimbó","Biblioteca Pública Municipal José Silva","Municipal","Praça Francelino de Araújo, s/n","Centro","",""
"Tacaratu","Biblioteca Pública Municipal Dom João de Souza Lima","Municipal","Rua Cavalcanti Nozinho, 181","Centro","8738431156",""
"Tamandaré","Biblioteca Pública Municipal Professora Rivalda Necir do Nascimento [confer","Municipal","Avenida José Bezerra Sobrinho, s/n","Centro","8136761135",""
"Taquaritinga do Norte","Biblioteca Pública Municipal Coronel Antônio Barbosa de Lucena","Municipal","Rua Aloísio Silvino, s/n","Centro","(81)3733-1156/1247","pmtaqdonorte@hotmail.com"
"Não identificado","Biblioteca Municipal Comunitária Maria Martins Cordeiro de Arruda","Municipal","Bairro Zamba","","",""
"Terezinha","Biblioteca Pública Municipal Assis Chateaubriand","Municipal","Avenida Agamenon Magalhães, s/n","Centro","8737921145",""
"Terra Nova","Biblioteca Pública Municipal Maria Angélica Freire de Carvalho","Municipal","Rua Manoel Gomes Vieira","","(87) 3892-1011",""
"Timbaúba","Biblioteca Pública Municipal Doutor Aderbal Jurema","Municipal","Rua Marechal Dantas Barreto, 291","Centro","",""
"Toritama","Biblioteca Pública Municipal Alice de Oliveira Cordeiro","Municipal","Rua Adalgisa Maura, 346","Centro","",""
"Tracunhaém","Biblioteca Pública Municipal Rui Barbosa","Municipal","Rua 7 de Setembro, s/n","Centro","8191282229",""
"Trindade","Biblioteca Pública Municipal Giovana Maria Lima Lins","Municipal","Avenida Central Sul, s/n","Centro","",""
"Triunfo","Biblioteca Pública Municipal Marli Ferreira Diniz","Municipal","Avenida Getúlio Vargas, 14-A","Centro","8799361876",""
"Tupanatinga","Biblioteca Pública Municipal de Tupanantinga","Municipal","Rua Santos Dumont, 55","Centro","",""
"Tuparetama","Biblioteca Pública Municipal Escritor Monteiro Lobato","Municipal","Rua Monsenhor Rabelo, s/n","Centro","8738281156",""
"Venturosa","Biblioteca Pública Municipal de Venturosa","Municipal","Avenida Capitão Justino Alves, 172","Centro","8791117191",""
"Verdejante","Biblioteca Pública Municipal Doutor Marco Antônio Maciel","Municipal","Avenida Antônio Pedro da Silva, s/n","Centro","8738861498",""
"Vertente do Lério","Biblioteca Pública Municipal de Vertente do Lério","Municipal","Avenida Capitão Luiz de França, s/n","Centro","",""
"Vertentes","Biblioteca Pública Municipal Professora Diva Pessoa Bezerra","Municipal","Rua Ivan Figueiroa, s/n","Centro","",""
"Vicência","Biblioteca Pública Municipal Estefânia Carneiro da Cunha","Municipal","Rua Oliveira Estelita, 70","Centro","",""
"Vitória de Santo Antão","Biblioteca Pública Municipal Cônego Américo Pita","Municipal","Rua Rui Barbosa, s/n","Lovramento","8135230862",""
